account_id,federal_account_symbol,federal_account_name
598,020-0141,"Small Business Lending Fund, Departmental Offices, Treasury"
599,020-0142,"State Small Business Credit Initiative, Departmental Offices, Treasury"
600,020-0146,"Social Impact Demonstration Projects, Departmental Offices, Treasury"
601,020-0150,"Emergency Rental Assistance, Departmental Offices, Treasury"
602,020-0151,"Public Broadcasting Fund, Corporation for Public Broadcasting, Treasury"
603,020-0156,"Transportation Services Economic Relief, Department Offices, Treasury"
604,020-0158,"Pandemic Relief for Aviation Workers, Departmental Offices, Treasury"
605,020-0159,"Payment to United States Virgin Islands and Puerto Rico for Disaster Tax Relief, Internal Revenue Service, Treasury"
606,020-0160,"Community Development Financial Institutions Fund Program, Emergency Support, Departmental Offices, Treasury"
607,020-0161,"Emergency Capital Investment Fund, Departmental Offices, Treasury"
608,020-0165,"Committee on Foreign Investment in the United States Fund, Departmental Offices, Treasury"
609,020-0173,"Salaries and Expenses, Financial Crimes Enforcement Network"
610,020-0500,"Public Debt Principal (Indefinite), Treasury"
611,020-0501,"Payment to the Legal Services Corporation, Legal Services Corporation"
612,020-0503,"Gain/Loss on Buyback of US Treasury Securities, Bureau of the Fiscal Service, Treasury"
613,020-0520,"Salaries and Expenses, Bureau of the Fiscal Service, Treasury"
614,020-0550,"Interest on the Public Debt (Indefinite), Bureau of the Fiscal Service, Treasury"
615,020-0562,"Reimbursements to Federal Reserve Banks, Bureau of the Fiscal Service, Treasury"
616,020-0575,"Sinking Fund, Treasury"
617,020-0903,"Refunding Internal Revenue Collections (Indefinite), Treasury"
618,020-0904,"Refunding Internal Revenue Collections, Interest (Indefinite), Treasury"
619,020-0905,"U.S. Coronavirus Payments, Internal Revenue Service, Treasury"
620,020-0906,"Payment Where Earned Income Credit Exceeds Liability for Tax, Internal Revenue Service, Treasury"
621,020-0912,"Taxpayer Services, Internal Revenue Service, Treasury"
622,020-0913,"Enforcement, Internal Revenue Service"
623,020-0919,"Operations Support, Internal Revenue Service, Treasury"
624,020-0921,"Business Systems Modernization, Internal Revenue Service, Treasury"
625,020-0922,"Payment Where Child Tax Credit Exceeds Liability for Tax, Internal Revenue Service, Treasury"
626,020-0923,"Payment Where Health Coverage Tax Credit Exceeds Liability for Tax, Internal Revenue Service, Treasury"
627,020-0931,"Payment Where Certain Tax Credits Exceeds Liability for Corporate Tax, Internal Revenue Service, Treasury"
628,020-0932,"Payment Where American Opportunity Credit Exceeds Liability for Tax - Recovery Act, Internal Revenue Service, Treasury"
629,020-0935,"Build America Bond Payments - Recovery Act, Internal Revenue Service, Treasury"
630,020-0936,"U.S. Coronavirus Refundable Credits, Internal Revenue Service, Treasury"
631,020-0943,"Child and Dependent Care Tax Credit, Internal Revenue Service, Department of the Treasury"
632,020-0945,"Payment to Issuer of Qualified Zone Academy Bonds, Internal Revenue Service, Treasury"
633,020-0946,"Payment to Issuer of Qualified School Construction Bonds, Internal Revenue Service, Treasury"
634,020-0947,"Payment to Issuer of New Clean Renewable Energy Bonds, Internal Revenue Service, Treasury"
635,020-0948,"Payment to Issuer of Qualified Energy Conservation Bonds, Internal Revenue Service, Treasury"
636,020-0949,"Refundable Premium Assistance Tax Credit, Internal Revenue Service, Treasury"
637,020-0951,"Payment Where Small Business Health Insurance Tax Credit Exceeds Liability for Tax, Internal Revenue Service, Treasury"
638,020-0957,"Direct E-File Taskforce, Internal Revenue Service, Treasury"
639,020-0958,"Energy Security, Internal Revenue Service, Treasury"
640,020-0962,"Advanced Manufacturing Investment Credit, Internal Revenue Service, Treasury"
641,020-0963,"Elective Payment for Energy Property and Electricity Produced from Certain Renewable Resources, Etc., Internal Revenue Service, Treasury"
642,020-0964,"Clean Vehicle Credit, Internal Revenue Service, Treasury"
643,020-0965,"Credit for Previously-Owned Clean Vehicles, Internal Revenue Service, Treasury"
644,020-1008,"Salaries and Expenses, Alcohol and Tobacco Tax and Trade Bureau, Treasury"
645,020-1039,"Contribution to the International Fund for Agricultural Development, Treasury"
646,020-1045,"International Affairs Technical Assistance, Office of Technical Assistance, Treasury"
647,020-1475,"Global Agriculture and Food Security Program, Treasury"
648,020-1699,"Contributions to the International Monetary Fund Facilities and Trust Funds, Treasury"
649,020-1701,"Federal Payment for the District of Columbia National Guard, Treasury"
650,020-1706,"Relief of Individuals and Others by Private and Public Laws, Bureau of the Fiscal Service, Treasury"
651,020-1710,"Payment of Government Losses in Shipment, Bureau of the Fiscal Service, Treasury"
652,020-1713,"Federal Payment to the District of Columbia Judicial Survivors and Annuity Fund, Treasury"
653,020-1714,"Federal Payment to the Federal District of Columbia Pension Fund, Treasury"
654,020-1736,"Federal Payment for Resident Tuition Support, Treasury"
655,020-1740,"Judgements, Court of Claims (Indefinite), Bureau of the Fiscal Service, Treasury"
656,020-1741,"Judgements, United States Courts (Indefinite), Bureau of the Fiscal Service, Treasury"
657,020-1742,"Claims for Damages (Indefinite), Bureau of the Fiscal Service, Treasury"
658,020-1743,"Claims for Contract Disputes (Indefinite), Bureau of the Fiscal Service, Treasury"
659,020-1748,"Claims for Fire Fighting Services (Indefinite), Bureau of the Fiscal Service, Treasury"
660,020-1771,"Federal Payment for Emergency Planning and Security Costs in the District of Columbia, Treasury"
661,020-1796,"Federal Payment to the District of Columbia Water and Sewer Authority, Treasury"
662,020-1801,"Salaries and Expenses, Bureau of the Fiscal Service, Treasury"
663,020-1802,"Financial Agent Services, Bureau of the Fiscal Service, Treasury"
664,020-1804,"Salaries and Expenses, Office of Terrorism and Financial Intelligence, Departmental Offices, Treasury"
665,020-1807,"Refund of Moneys Erroneously Received and Covered (Indefinite), Treasury"
666,020-1817,"Federal Payment for School Improvement, Treasury"
667,020-1818,"Federal Payment to the Criminal Justice Coordinating Council, Treasury"
668,020-1820,"Federal Payment for Central Library and Branch Locations, Treasury"
669,020-1822,"Federal Payment for Judicial Commissions, Treasury"
670,020-1824,"Federal Payment for Testing and Treatment of HIV/AIDS, Treasury"
671,020-1851,"Payment to the Resolution Funding Corporation, Bureau of the Fiscal Service, Treasury"
672,020-1855,"Cybersecurity Enhancement Account, Departmental Offices, Treasury"
673,020-1860,"Interest on Uninvested Funds (Indefinite),  Bureau of the Fiscal Service, Treasury"
674,020-1875,"Restitution of Forgone Interest, Bureau of the Fiscal Service, Treasury"
675,020-1877,"Federal Interest Liabilities to the States, Bureau of the Fiscal Service, Treasury"
676,020-1880,"Credit Reform:  Interest Paid on Uninvested Funds (Indefinite),  Bureau of the Fiscal Service, Treasury"
677,020-1881,"Community Development Financial Institutions Fund, Program Account, Treasury"
678,020-1884,"Federal Reserve Bank Reimbursement Fund,  Bureau of the Fiscal Service, Treasury"
679,020-1889,"Economic Stabilization Program Account, Departmental Offices, Treasury"
680,020-1892,"Coronavirus Relief Fund, Departmental Offices, Treasury"
681,020-1893,"Special Inspector General for Pandemic Recovery, Treasury"
682,020-1894,"Air Carrier Worker Support, Departmental Offices, Department of Treasury"
683,020-1896,"Coronavirus Capital Projects Fund, Departmental Offices, Treasury"
684,020-1897,"Local Assistance and Tribal Consistency Fund, Departmental Offices, Treasury"
685,020-1916,"Treasury International Assistance Programs, Bureau of the Fiscal Service, Treasury"
686,020-1921,IT System Modernization and Working Capital Fund
687,020-4109,"United States Treasury Check Forgery Insurance Fund,  Bureau of the Fiscal Service, Treasury"
688,020-4159,"United States Mint Public Enterprise Fund, Treasury"
689,020-4394,"Financial Integrity Fund, Financial Crimes Enforcement Network, Treasury"
690,020-4413,"Federal Tax Lien Revolving Fund, Internal Revenue Service, Treasury"
691,020-4444,"Exchange Stabilization Fund, Office of the Secretary, Treasury"
692,020-4446,"Federal Payment for Water and Sewer Services, Treasury"
693,020-4502,"Bureau of Engraving and Printing Fund, Treasury"
694,020-4521,"Federal Financing Bank Revolving Fund, Treasury"
695,020-4560,"Treasury Franchise Fund, Treasury"
696,020-5080,"Gifts to Reduce Debt Held by the Public, Bureau of the Fiscal Service, Treasury"
697,020-5081,"Presidential Election Campaign Fund, Treasury"
698,020-5432,"Internal Revenue Service, Miscellaneous Retained Fees, Treasury"
699,020-5433,"Informant Payments, Internal Revenue Service, Treasury"
700,020-5445,"Debt Collection Fund, Bureau of the Fiscal Service, Treasury"
701,020-5510,"Private Collection Agent Program, Internal Revenue Service, Treasury"
702,020-5511,"District of Columbia Federal Pension Fund, Treasury"
703,020-5581,"HOPE Reserve Fund, Bureau of the Fiscal Service, Treasury"
704,020-5590,"Financial Research Fund, Departmental Offices, Treasury"
705,020-5622,"Special Compliance Personnel Program, Internal Revenue Service, Treasury"
706,020-5680,"Guam World War II Claims Fund, Treasury"
707,020-5688,"Continued Dumping and Subsidy Offset, United States Customs Service, Treasury"
708,020-5697,"Treasury Forfeiture Fund, Treasury"
709,020-5737,"Internal Revenue, Collections for Puerto Rico, Treasury"
710,020-8207,"Lower Brule Sioux Tribe Terrestrial Wildlife Habitat Restoration Trust Fund,  Bureau of the Fiscal Service, Treasury"
711,020-8209,"Cheyenne River Sioux Tribe Terrestrial Wildlife Habitat Restoration Trust Fund, Bureau of the Fiscal Service, Treasury"
712,020-8212,"District of Columbia Judicial Retirement and Survivor's Annuity Fund, Treasury"
713,020-8413,"Assessment Funds, Office of the Comptroller of the Currency, Treasury"
714,020-8524,"Capital Magnet Fund, Community Development Financial Institutions, Departmental Offices, Treasury"
715,020-8625,"Gulf Coast Restoration Trust Fund, Bureau of the Fiscal Service, Treasury"
716,020-8790,"Gifts and Bequests, Treasury"
717,021-0720,"Family Housing Construction, Army"
718,021-0725,"Family Housing Operation and Maintenance, Army"
719,021-0810,"Environmental Restoration, Army"
720,021-1004,"Medicare-Eligible Retiree Health Fund Contribution, Army"
721,021-1005,"Medicare-Eligible Retiree Health Fund Contribution, Reserve Personnel, Army"
722,021-1006,"Medicare-Eligible Retiree Health Fund Contribution, National Guard Personnel, Army"
723,021-1805,"Salaries and Expenses, Cemeterial Expenses, Army"
724,021-1809,"Construction, Cemeterial Expenses, Army"
725,021-2010,"Military Personnel, Army"
726,021-2020,"Operation and Maintenance, Army"
727,021-2031,"Aircraft Procurement, Army"
728,021-2032,"Missile Procurement, Army"
729,021-2033,"Procurement of Weapons and Tracked Combat Vehicles, Army"
730,021-2034,"Procurement of Ammunition, Army"
731,021-2035,"Other Procurement, Army"
732,021-2040,"Research, Development, Test, and Evaluation, Army"
733,021-2050,"Military Construction, Army"
734,021-2060,"National Guard Personnel, Army"
735,021-2065,"Operation and Maintenance, Army National Guard"
736,021-2070,"Reserve Personnel, Army"
737,021-2080,"Operation and Maintenance, Army Reserve"
738,021-2085,"Military Construction, Army National Guard"
739,021-2086,"Military Construction, Army Reserve"
740,021-2089,"Iraq Relief and Reconstruction Fund, Army"
741,021-2090,"Operating Expenses of the Coalition Provisional Authority, Army"
742,021-2091,"Afghanistan Security Forces Fund, Army"
743,021-2099,"Counter-ISIS Train and Equip Fund, Army"
744,021-5095,"Wildlife Conservation, Etc., Military Reservations, Army"
745,021-5098,"Restoration, Rocky Mountain Arsenal, Army"
746,021-5285,"Department of Defense, Forest Products Program, Army"
747,021-5286,"National Science Center, Army"
748,021-5602,"National Military Cemeteries Concessions, Army"
749,021-5752,"Department of Defense Korean War Commemoration Fund, Army"
750,021-5756,"Natick Land Conveyance, Army"
751,021-8063,"Bequest of Major General Fred C. Ainsworth, Library, Walter Reed General Hospital, Army"
752,021-8721,Heritage Center for the National Museum of the United States Army
753,021-8927,"Department of the Army General Gift Fund, Army"
754,024-0100,"Salaries and Expenses, Office of Personnel Management"
755,024-0200,"Payment to Civil Service Retirement and Disability Fund, Office of Personnel Management"
756,024-0206,"Government Payment for Annuitants, Employees' Health Benefits, Office of Personnel Management"
757,024-0400,"Salaries and Expenses, Office of Inspector General, Office of Personnel Management"
758,024-0500,"Government Payment for Annuitants, Employee Life Insurance     Benefits, Office of Personnel Management"
759,024-0600,"OPM Building Delegation Fund, Office of Personnel Management"
760,024-0800,"Flexible Benefits Plan Reserve, Office of Personnel Management"
761,024-0806,"Emergency Federal Employee Leave Fund, Office of Personnel Management"
762,024-0813,"Postal Service Health Benefits Program Implementation Fund, Office of Personnel Management"
763,024-1162,"IT Modernization and Working Capital, Office of Personnel Management"
764,024-4571,"Revolving Fund, Undistributed SIBAC Chargebacks for Washington, DC, Office of Personnel Management"
765,024-5391,"Postal Service Contributions for Retiree Health Benefits, Office of Personnel Management"
766,024-8135,"Civil Service Retirement and Disability Fund, Office of Personnel Management"
767,024-8424,"Employees' Life Insurance Fund, Office of Personnel Management"
768,024-8440,"Employees' Health Benefits Fund, Office of Personnel Management"
769,024-8445,"Retired Employees' Health Benefits Fund, Office of Personnel Management"
770,025-4472,"Community Development Revolving Loan Fund, National Credit Union"
771,027-0100,"Salaries and Expenses, Federal Communications Commission"
772,027-0300,"Spectrum Auction Program Account, Federal Communications Commission"
773,027-1911,"Affordable Connectivity Fund, Federal Communications Commission"
774,027-1912,"Secure and Trusted Communications Networks Reimbursement Program, Federal Communications Commission"
775,027-1913,"Emergency Connectivity Fund for Educational Connections and Devices, Federal Communications Commission"
776,027-5183,"Universal Service Fund, Federal Communications Commission"
777,027-5610,"TV Broadcaster Relocation Fund, Federal Communications Commission"
778,027-5700,"Telecommunications Relay Services Fund, Federal Communications Commission"
779,028-0400,"Office of the Inspector General, Social Security Administration"
780,028-0401,"Special Benefits for Certain World War II Veterans, Social Security Administration"
781,028-0404,"Payments to Social Security Trust Funds, Social Security Administration"
782,028-0406,"Supplemental Security Income Program, Social Security Administration"
783,028-0415,"Administrative Costs, The Medicare Improvements for Patients and Providers Act, Social Security Administration"
784,028-0416,"Administrative Expenses, Children's Health Insurance Program, Social Security Administration"
785,028-0417,"Limitation on Administrative Expenses - Recovery Act, Social Security Administration"
786,028-0419,"Payment to Limitation on Administrative Expenses, Social Security Administration"
787,028-0440,"Payments for Credits Against Social Security Contributions, Social Security Administration"
788,028-5419,"State Supplemental Fees, Social Security Administration"
789,028-8006,"Federal Old-Age and Survivors Insurance Trust Fund - Treasury Managed, Social Security Administration"
790,028-8007,"Federal Disability Insurance Trust Fund - Treasury Managed, Social Security Administration"
791,028-8704,"Salaries and Expenses, Social Security Administration"
792,029-0100,"Salaries and Expenses, Federal Trade Commission"
793,031-0200,"Salaries and Expenses, Nuclear Regulatory Commission"
794,031-0300,"Office of the Inspector General, Nuclear Regulatory Commission"
795,031-5280,"Nuclear Facilities Fees Fund, Nuclear Regulatory Commission"
796,034-0100,"Salaries and Expenses, International Trade Commission"
797,036-0102,"Compensation and Pensions, Veterans Benefits Administration, Veterans Affairs"
798,036-0110,"Construction, Major Projects, Departmental Administration, Veterans Affairs"
799,036-0111,"Construction, Minor Projects, Departmental Administration, Veterans Affairs"
800,036-0120,"Veterans Insurance and Indemnities, Veterans Benefits Administration, Veterans Affairs"
801,036-0129,"National Cemetery Administration, Veterans Health Administration, Veterans Affair"
802,036-0131,"Emergency Department of Veterans Affairs Employee Leave Fund, Veterans Health Administration, Veterans Affairs"
803,036-0137,"Readjustment Benefits, Veterans Benefits Administration, Veterans Affairs"
804,036-0140,"Medical Community Care, Veterans Health Administration, Veterans Affairs"
805,036-0142,"General Administration, Departmental Administration, Veterans Affairs"
806,036-0151,"General Operating Expenses, Veterans Benefits Administration, Veterans Affairs"
807,036-0152,"Medical Support and Compliance, Veterans Health Administration, Veterans Affairs"
808,036-0160,"Medical Services, Veterans Health Administration, Veterans Affairs"
809,036-0161,"Medical and Prosthetic Research, Veterans Health Administration, Veterans Affairs"
810,036-0162,"Expenses, Medical Facilities, Veterans Health Administration, Veterans Affairs"
811,036-0165,"DOD-VA Health Care Sharing Incentive Fund, Veterans Affairs"
812,036-0167,"Information Technology Systems, Departmental Administration, Veterans Affairs"
813,036-0169,"Joint Department of Defense - Department of Veterans Affairs Medical Facility Demonstration Fund, Veterans Affairs"
814,036-0170,"Office of Inspector General, Departmental Administration, Veterans Affairs"
815,036-0172,"Veterans Choice Fund, Veterans Health Administration, Veterans Affairs"
816,036-0173,"Veterans Medical Care and Health Fund, Veterans Health Administration, Veterans Affairs"
817,036-0181,"Grants for Construction of State Extended Care Facilities, Departmental Administration, Veterans Affairs"
818,036-0183,"Grants for Construction of State Veterans Cemeteries, Departmental Administration, Veterans Affairs"
819,036-1114,"Vocational Rehabilitation Loans Program Account, Veterans Benefits Administration, Veterans Affairs"
820,036-1119,"Veterans Housing Benefit Program Fund, Veterans Benefits Administration, Veterans Affairs"
821,036-1120,"Native American Veteran Housing Loan Program Account, Veterans Benefits Administration, Veterans Affairs"
822,036-1121,"Filipino Veterans Equity Compensation Fund, Benefits Programs, Veterans Affairs"
823,036-1122,"Board of Veterans Appeals, Departmental Administration, Veterans Affairs"
824,036-1123,"Veterans Electronic Health Record, Departmental Administration, Veterans Affairs"
825,036-1124,"Recurring Expenses Transformational Fund, Departmental Administration, Veterans Affairs"
826,036-1126,"Cost of War Toxic Exposures Fund, Departmental Administration, Veterans Affairs"
827,036-4009,"Servicemen's Group Life Insurance Fund, Veterans Affairs"
828,036-4010,"Veterans Reopened Insurance Fund, Veterans Affairs"
829,036-4012,"Service-Disabled Veterans Insurance Fund, Veterans Affairs"
830,036-4014,"Canteen Service Revolving Fund, Veterans Affairs"
831,036-4018,"Pershing Hall Revolving Fund, Veterans Affairs"
832,036-4025,"Veterans Housing Benefit Program Fund Liquidating Account, Veterans Affairs"
833,036-4379,"Veteran Affairs Life Insurance, Veterans Benefits Administration, Veterans Affairs"
834,036-4537,"Supply Fund, Veterans Affairs"
835,036-4539,"Franchise Fund, Veterans Affairs"
836,036-5287,"Medical Care Collections Fund, Veterans Affairs"
837,036-5392,"National Cemetery Administration Facilities Operation Fund, Veterans Affairs"
838,036-8129,"Department of Veterans Affairs Cemetery Gift Fund, Veterans Affairs"
839,036-8132,"National Service Life Insurance Fund, Veterans Affairs"
840,036-8133,"Post-Vietnam Era, Veterans Education Account, Veterans Affairs"
841,036-8150,"United States Government Life Insurance Fund, Veterans Affairs"
842,036-8180,"General Post Fund, National Homes, Veterans Affairs"
843,036-8455,"Veterans Special Life Insurance Fund, Trust Revolving Fund, Veterans Affairs"
844,045-0100,"Salaries and Expenses, Equal Employment Opportunity Commission"
845,045-4019,"EEOC Education, Technical Assistance and Training Revolving Fund, Equal Employment Opportunity Commission"
846,049-0100,"Research and Related Activities, National Science Foundation"
847,049-0106,"STEM Education, National Science Foundation"
848,049-0108,"Creating Helpful Incentives to Produce Semiconductors (CHIPS) for America Workforce and Education Fund, National Science Foundation"
849,049-0180,"Agency Operations and Award Management, National Science Foundation"
850,049-0300,"Office of Inspector General, National Science Foundation"
851,049-0350,"Office of the National Science Board, National Science Foundation"
852,049-0551,"Major Research Equipment and Facilities Construction, National Science Foundation"
853,049-5176,"Salaries and Expenses, H-1B Funded, Education  and Human Resources, National Science Foundation"
854,049-8960,"Donations, National Science Foundation"
855,050-0100,"Salaries and Expenses, Securities and Exchange Commission"
856,050-5566,"Securities and Exchange Commission Reserve Fund, Securities and Exchange Commission"
857,050-5567,"Investor Protection Fund, Securities and Exchange Commission"
858,051-4065,The FSLIC Resolution Fund
859,051-4067,"Operating Account, Federal Deposit Insurance Corporation"
860,051-4596,"Deposit Insurance Fund, Federal Deposit Insurance Corporation"
861,054-0100,"Salaries and Expenses, Federal Labor Relations Authority"
862,057-0740,"Family Housing Construction, Air Force"
863,057-0745,"Family Housing Operation and Maintenance, Air Force"
864,057-0810,"Environmental Restoration, Air Force"
865,057-1007,"Medicare-Eligible Retiree Health Fund Contribution, Air Force"
866,057-1008,"Medicare-Eligible Retiree Health Fund Contribution, Reserve Personnel, Air Force"
867,057-1009,"Medicare-Eligible Retiree Health Fund Contribution, National Guard Personnel, Air Force"
868,057-1010,"Medicare-Eligible Retiree Health Fund Contribution, Space Force, Air Force"
869,057-3010,"Aircraft Procurement, Air Force"
870,057-3011,"Procurement of Ammunition, Air Force"
871,057-3020,"Missile Procurement, Air Force"
872,057-3021,"Space Procurement, Air Force"
873,057-3022,"Procurement, Space Force, Air Force"
874,057-3080,"Other Procurement, Air Force"
875,057-3300,"Military Construction, Air Force"
876,057-3400,"Operation and Maintenance, Air Force"
877,057-3410,"Operation and Maintenance, Space Force"
878,057-3500,"Military Personnel, Air Force"
879,057-3510,"Military Personnel, Space Force, Air Force"
880,057-3600,"Research, Development, Test, and Evaluation, Air Force"
881,057-3620,"Research, Development, Test, and Evaluation, Space Force, Air Force"
882,057-3700,"Reserve Personnel, Air Force"
883,057-3730,"Military Construction, Air Force Reserve"
884,057-3740,"Operation and Maintenance, Air Force Reserve"
885,057-3830,"Military Construction, Air National Guard"
886,057-3840,"Operation and Maintenance, Air National Guard"
887,057-3850,"National Guard Personnel, Air Force"
888,057-5095,"Wildlife Conservation, Etc., Military Reservations, Air Force"
889,057-5616,"Support of Athletic Programs, Air Force"
890,057-8418,"Air Force Cadet Fund, Air Force"
891,057-8928,"Department of the Air Force General Gift Fund, Air Force"
892,060-0111,"Dual Benefits Payments Account, Railroad Retirement Board"
893,060-0113,"Federal Payments to the Railroad Retirement Accounts, Railroad Retirement Board"
894,060-0114,"Railroad Unemployment Insurance Extended Benefit Payments - Recovery Act, Railroad Retirement Board"
895,060-0117,"Railroad Unemployment Insurance Extended Benefits Payments, Railroad Retirement Board"
896,060-0122,"Railroad Unemployment Insurance Enhanced Benefit Payments, Railroad Retirement Board"
897,060-0123,"Railroad Unemployment Insurance Waiver of 7 Day Period, Railroad Retirement Board"
898,060-8010,"Social Security Equivalent Benefit Account, Railroad Retirement Board"
899,060-8011,"Railroad Retirement Account, Railroad Retirement Board"
900,060-8018,"Limitation on the Office of the Inspector General, Railroad Retirement Board"
901,060-8051,"Railroad Unemployment Insurance Trust Fund, Benefit Payments, Railroad Retirement Board"
902,060-8118,"National Railroad Retirement Investment Trust, Railroad Retirement Board"
903,060-8237,"Limitation on Administration, Railroad Retirement Board"
904,061-0100,"Salaries and Expenses, Consumer Product Safety Commission"
905,061-8079,"Gifts and Donations, Consumer Product Safety Commission"
906,062-0100,"Salaries and Expenses, Office of Special Counsel"
907,065-0100,"Salaries and Expenses, Federal Maritime Commission"
908,068-0103,"State and Tribal Assistance Grants, Environmental Protection Agency"
909,068-0107,"Science and Technology, Environmental Protection Agency"
