account_id,federal_account_symbol,federal_account_name
910,068-0108,"Environmental Programs and Management, Environmental Protection Agency"
911,068-0109,"Energy Research and Development, Environmental Protection Agency"
912,068-0110,"Buildings and Facilities, Environmental Protection Agency"
913,068-0112,"Office of Inspector General, Environmental Protection Agency"
914,068-0250,"Payment to the Hazardous Substances Superfund, Environmental Protection Agency"
915,068-0251,"Payment to the Leaking Underground Storage Tank Trust Fund, Environmental Protection Agency"
916,068-0254,"Water Infrastructure Finance And Innovation Program Account, Environmental Protection Agency"
917,068-4310,"Reregistration and Expedited Processing Revolving Fund, Environmental Protection Agency"
918,068-4330,"Hazardous Waste Electronic Manifest System Fund, Environmental Protection Agency"
919,068-4365,"Damage Assessment and Restoration Revolving Fund, Environmental Protection Agency"
920,068-4565,"Working Capital Fund, Environmental Protection Agency"
921,068-5297,"Exxon Valdez Settlement Fund, Environmental Protection Agency"
922,068-5374,"Pesticide Registration Fund, Environmental Protection Agency"
923,068-8145,"Hazardous Substance Superfund, Environmental Protection Agency"
924,068-8153,"Leaking Underground Storage Tank Trust Fund, Environmental Protection Agency"
925,068-8221,"Inland Oil Spill Programs, Environmental Protection Agency"
926,069-0102,"Salaries and Expenses, Office of the Secretary, Transportation"
927,069-0104,"Research and Special Programs, Pipeline and Hazardous Materials Safety Administration, Transportation"
928,069-0110,"Aviation Manufacturing Payroll Support Program, Office of the Secretary, Transportation"
929,069-0116,"Financial Management Capital, Office of the Secretary, Transportation"
930,069-0118,"Office of Civil Rights, Office of the Secretary, Transportation"
931,069-0119,"Small and Disadvantaged Business Utilization and Outreach, Office of the Secretary, Transportation"
932,069-0120,"Efficiency Incentive Grants to the National Railroad Passenger Corporation, Federal Railroad Administration, Transportation"
933,069-0121,"Operating Grants to the National Railroad Passenger Corporation, Federal Railroad Administration, Transportation"
934,069-0123,"Northeast Corridor Improvement Program, Federal Railroad Administration, Transportation"
935,069-0125,"Capital and Debt Service Grants to the National Railroad Passenger Corporation, Federal Railroad Administration, Transportation"
936,069-0127,"Restoration and Enhancement Grants, Federal Railroad Administration, Transportation"
937,069-0129,"Magnetic Levitation Technology Deployment Program, Federal Railroad Administration, Transportation"
938,069-0130,"Salaries and Expenses, Office of Inspector General, Transportation"
939,069-0142,"Transportation Planning, Research and Development, Office of the Secretary, Transportation"
940,069-0143,"National Infrastructure Investments, Office of the Secretary, Transportation"
941,069-0147,"New Headquarters Building, Office of the Secretary, Transportation"
942,069-0149,"General Fund Payment To National Surface Transportation and Innovative Finance Bureau Highway Trust Fund Account, Upward Reestimates, Office of Secretary, Transportation"
943,069-0155,"Minority Business Resource Center Program, Office of the Secretary, Transportation"
944,069-0159,"Cyber Security Initiatives, Office of the Secretary, Transportation"
945,069-0162,"Thriving Communities, Office of the Secretary, Transportation"
946,069-0170,"National Surface Transportation and Innovative Finance Bureau, Office of the Secretary, Transportation"
947,069-0250,"Payment to the Airport and Airway Trust Fund, Federal Aviation Administration, Transportation"
948,069-0500,"Emergency Relief Program, Federal Highway Administration, Transportation"
949,069-0505,"Surface Transportation Projects, Federal Highway Administration, Transportation"
950,069-0533,"Highway Studies Feasibility, Design, Environmental, Engineering, Federal Highway Administration, Transportation"
951,069-0534,"Payment to the Highway Trust Fund, Federal Highway Administration, Transportation"
952,069-0538,"Surface Transportation Priorities, Federal Highway Administration, Transportation"
953,069-0540,"Highway Beautification, Federal Highway Administration, Transportation"
954,069-0542,"TIFIA General Fund Program Account, Office of the Secretary, Transportation"
955,069-0548,"Highway Infrastructure Programs, Federal Highway Administration, Transportation"
956,069-0549,"State Infrastructure Banks, Federal Highway Administration, Transportation"
957,069-0550,"I-35W Bridge Repair and Reconstruction, Federal Highway Administration, Transportation"
958,069-0551,"Delta Regional Transportation Development Program, Federal Highway Administration, Transportation"
959,069-0557,"Railroad-Highway Crossings Demonstration Projects, Federal Highway Administration, Transportation"
960,069-0560,"Interstate Transfer Grants-Highways, Federal Highway Administration, Transportation"
961,069-0564,"Intersection Safety Demonstration Project, Federal Highway Administration, Transportation"
962,069-0566,"Climbing Lane and Highway Safety Demonstration Project, Federal Highway Administration, Transportation"
963,069-0572,"Kentucky Bridge Project, Federal Highway Administration, Transportation"
964,069-0580,"Expressway Safety Improvement Demonstration Project, Federal Highway Administration, Transportation"
965,069-0583,"Highway Demonstration Projects, Preliminary Engineering, Federal Highway Administration, Transportation"
966,069-0592,"Turquoise Trail Project, Federal Highway Administration, Transportation"
967,069-0598,"Highway Demonstration Projects, Federal Highway Administration, Transportation"
968,069-0640,"Appalachian Development System, Federal Highway Administration, Transportation"
969,069-0641,"Miscellaneous Highway Project, Federal Highway Administration, Transportation"
970,069-0644,"Arkansas I-69 Connector, Federal Highway Administration, Transportation"
971,069-0646,"Alabama and West Virginia Highway Projects, Federal Highway Administration, Transportation"
972,069-0647,"Neighborhood Access and Environmental Programs, Federal Highway Administration, Transportation"
973,069-0650,"Operations and Research, National Highway Traffic Safety Administration, Transportation"
974,069-0651,"State and Community Highway Safety, Liquidation of Contract Authorization, National Highway Traffic Safety Administration, Transportation"
975,069-0654,"Consumer Assistance to Recycle and Save Program, National Highway Traffic Safety Administration, Transportation"
976,069-0661,"Next Generation 911 Implementation Grants, National Highway Traffic Safety Administration, Transportation"
977,069-0669,"Crash Data, National Highway Traffic Safety Administration, Transportation"
978,069-0670,"Vehicle Safety and Behavioral Research Programs, National Highway Traffic Safety Administration, Transportation"
979,069-0671,"Supplemental Highway Traffic Safety Programs, National Highway Traffic Safety Administration, Transportation"
980,069-0700,"Safety and Operations, Federal Railroad Administration, Transportation"
981,069-0701,"Railroad Safety Technology Program, Federal Railroad Administration, Transportation"
982,069-0702,"Railroad Safety, Federal Railroad Administration, Transportation"
983,069-0703,"Railroad Research, Federal Railroad Administration, Transportation"
984,069-0704,"Grants to the National Railroad Passenger Corporation, Federal Railroad Administration, Transportation"
985,069-0707,"Rail Labor Assistance, Federal Railroad Administration, Transportation"
986,069-0714,"Local Rail Freight Assistance, Federal Railroad Administration, Transportation"
987,069-0715,"Passenger Rail Service, Capital Assistance to States - Intercity, Federal Railroad Administration, Transportation"
988,069-0716,"Rail Line Relocation and Improvement Program, Federal Railroad Administration, Transportation"
989,069-0719,"Capital Assistance for High Speed Rail Corridors and Intercity Passenger Rail Service, Federal Railroad Administration, Transportation"
990,069-0722,"Next Generation High Speed Rail, Federal Railroad Administration, Transportation"
991,069-0726,"Rhode Island Rail Development, Federal Railroad Administration, Transportation"
992,069-0745,"Railroad Research and Development, Federal Railroad Administration, Transportation"
993,069-0750,"Railroad Rehabilitation and Improvement Financing Program, Office of the Secretary, Transportation"
994,069-0758,"West Virginia Rail Development, Federal Railroad Administration, Transportation"
995,069-0759,"Financial Assistance Oversight and Technical Assistance, Federal Railroad Administration, Transportation"
996,069-0760,"Railroad Crossing Elimination Program, Federal Railroad Administration, Transportation"
997,069-1119,"Urban Mass Transportation Fund, Federal Transit Administration, Transportation"
998,069-1120,"Administrative Expenses, Federal Transit Administration, Transportation"
999,069-1121,"Research, Training, and Human Resources, Federal Transit Administration, Transportation"
1000,069-1122,"Urban Discretionary Grants, Federal Transit Administration, Transportation"
1001,069-1123,"Non-Urban Formula Grants, Federal Transit Administration, Transportation"
1002,069-1124,"Urban Formula Grants, Federal Transit Administration, Transportation"
1003,069-1125,"Job Access and Reverse Commute Grants, Federal Transit Administration, Transportation"
1004,069-1126,"Waterborne Transportation Demonstration Project, Federal Transit Administration, Transportation"
1005,069-1127,"Interstate Transfer Grants-Transit, Federal Transit Administration, Transportation"
1006,069-1128,"Washington Metropolitan Area Transit Authority, Federal Transit Administration, Transportation"
1007,069-1129,"Formula Grants, Federal Transit Administration, Transportation"
1008,069-1134,"Capital Investments Grants, Federal Transit Administration, Transportation"
1009,069-1136,"University Transportation Research, Federal Transit Administration, Transportation"
1010,069-1137,"Transit Research, Federal Transit Administration, Transportation"
1011,069-1140,"Public Transportation Emergency Relief Program, Federal Transit Administration, Transportation"
1012,069-1142,"Technical Assistance and Training, Federal Transit Administration, Transportation"
1013,069-1144,"Electric or Low-Emitting Ferry Program, Federal Transit Administration, Transportation"
1014,069-1145,"All Stations Accessibility Program, Federal Transit Administration, Transportation"
1015,069-1146,"Ferry Service for Rural Communities, Federal Transit Administration, Transportation"
1016,069-1301,"Operations, Federal Aviation Administration, Transportation"
1017,069-1308,"Facilities and Equipment, Federal Aviation Administration, Transportation"
1018,069-1309,"TIFIA ARRA General Fund Program Account, Office of the Secretary, Transportation"
1019,069-1337,"Airport Terminal Program, Federal Aviation Administration, Transportation"
1020,069-1338,"Airport Infrastructure Grants, Federal Aviation Administration, Transportation"
1021,069-1339,"Research, Engineering, and Development, Federal Aviation Administration, Transportation"
1022,069-1400,"Operational Expenses, Pipeline and Hazardous Materials Safety Administration, Transportation"
1023,069-1401,"Hazardous Materials Safety, Pipeline and Hazardous Materials Safety Administration, Transportation"
1024,069-1402,"Natural Gas Distribution Infrastructure Safety and Modernization Grant Program, Pipeline and Hazardous Materials Safety Administration, Transportation"
1025,069-1710,"Ready Reserve Force, Maritime Administration, Transportation"
1026,069-1711,"Maritime Security Program, Maritime Administration, Transportation"
1027,069-1712,"State Maritime Academy Operations, Maritime Administration, Transportation"
1028,069-1713,"Port Infrastructure Development Program, Maritime Administration, Transportation"
1029,069-1717,"Cable Security Fleet, Maritime Administration, Transportation"
1030,069-1718,"Tanker Security Program, Maritime Administration, Transportation"
1031,069-1730,"Research and Technology, Office of the Secretary, Transportation"
1032,069-1731,"Transportation Demonstration Program, Office of the Secretary, Transportation"
1033,069-1732,"Operational Support, Office of the Secretary, Transportation"
1034,069-1733,"National Culvert Removal, Replacement, and Restoration Grant Program, Office of the Secretary, Transportation"
1035,069-1734,"Strengthening Mobility and Revolutionizing Transportation Grant Program, Office of the Secretary, Transportation"
1036,069-1735,"Safe Streets and Roads for All, Office of the Secretary, Transportation"
1037,069-1736,"Asset Concessions and Innovative Finance Assistance, Office of the Secretary, Transportation"
1038,069-1750,"Operations and Training, Maritime Administration, Transportation"
1039,069-1752,"Maritime Guaranteed Loan, (Title XI) Program Account, Maritime Administration, Transportation"
1040,069-1768,"Ship Disposal, Maritime Administration, Transportation"
1041,069-1770,"Assistance to Shipyards, Maritime Administration, Transportation"
1042,069-1774,"Northeast Corridor Grants to the National Railroad Passenger Corporation, Transportation"
1043,069-1775,"National Network Grants to the National Railroad Passenger Corporation, Transportation"
1044,069-2810,"Federal-State Partnership for Intercity Passenger Rail Grants, Federal Railroad Administration, Transportation"
1045,069-2811,"Consolidated Rail Infrastructure and Safety Improvements Grants, Federal Railroad Administration, Transportation"
1046,069-2812,"Transit Infrastructure Grants, Federal Transit Administration, Transportation"
1047,069-2813,"Grants-In-Aid for Airports, Federal Aviation Administration, Transportation"
1048,069-2815,"Relief for Airports, Federal Aviation Administration, Transportation"
1049,069-2816,"Emergency FAA Employee Leave Fund, Federal Aviation Administration, Transportation"
1050,069-2817,"Motor Carrier Safety Grants, Federal Motor Carrier Safety Administration, Transportation"
1051,069-2818,"Motor Carrier Safety Operations and Programs, Federal Motor Carrier Safety Administration, Transportation"
1052,069-2819,"Grants-in-Aid for Airports, Federal Aviation Administration, Transportation"
1053,069-2820,"Rural and Tribal Infrastructure Advancement, Office of the Secretary, Transportation"
1054,069-4089,"Great Lakes St. Lawrence Seaway Development Corporation Fund, Transportation"
1055,069-4120,"Aviation Insurance Revolving Fund, Transportation"
1056,069-4302,"War-Risk Insurance Revolving Fund, Maritime Administration, Transportation"
1057,069-4303,"Vessel Operations Revolving Fund, Maritime Administration, Transportation"
1058,069-4520,"Working Capital Fund, Office of the Secretary,Transportation"
1059,069-4522,"Working Capital Fund, Transportation Systems Center, Transportation"
1060,069-4562,"Administrative Services Franchise Fund, Federal Aviation Administration, Transportation"
1061,069-5172,"Pipeline Safety, Pipeline and Hazardous Materials Safety Administration, Transportation"
1062,069-5282,"Emergency Preparedness Grant, Pipeline and Hazardous Materials Safety Administration, Transportation"
1063,069-5422,"Aviation User Fees, Federal Aviation Administration, Transportation"
1064,069-5423,"Essential Air Service and Rural Airport Improvement Fund, Office of the Secretary, Transportation"
1065,069-5560,"Port of Guam Improvement Enterprise Fund, Maritime Administration, Transportation"
1066,069-8001,"Intermodal Urban Demonstration Project, Federal Highway Administration, Transportation"
1067,069-8002,"Carpool and Vanpool Projects, Federal Highway Administration"
1068,069-8003,"Operations and Maintenance, Great Lakes St. Lawrence Seaway Development Corporation, Transportation"
1069,069-8009,"Trust Fund Share of Other Highway Programs, Federal Highway Administration, Transportation"
1070,069-8014,"Baltimore-Washington Parkway Trust Fund, Federal Highway Administration, Transportation"
1071,069-8016,"Operation and Research, Liquidation of Contract Authorization, Limitation on Obligations, Highway Trust Fund, Transportation"
1072,069-8017,"Highway Safety Research and Development, Federal Highway Administration, Transportation"
1073,069-8019,"Highway-Related Safety Grants, Liquidation of Contract Authorization, Trust Fund, Federal Highway Administration, Transportation"
1074,069-8020,"Highway Traffic Safety Grants, Liquidation of Contract Authorization, Trust Fund, National Highway Traffic Safety Administration, Transportation"
1075,069-8045,"Study of Improvements to Highway 8 in Wisconsin, Federal Highway Administration, Transportation"
1076,069-8048,"National Motor Carrier Safety Program, Liquidation of Contract Authorization, Federal Motor Carrier Safety Administration, Transportation"
1077,069-8054,"Advances from State Cooperating Agencies, Foreign Governments, and Other Federal Agencies, Federal Highway Administration, Transportation"
1078,069-8057,"Bridge Capacity Improvement, Federal Highway Administration, Transportation"
1079,069-8058,"Miscellaneous Highway Project, Federal Highway Administration, Transportation"
1080,069-8061,"Construction and Improvements to Halls Mills Road, New Jersey, Federal Highway Administration, Transportation"
1081,069-8072,"Appalachian Development Highway System, Federal Highway Administration, Transportation"
1082,069-8083,"Federal-Aid Highways, Liquidation of Contract Authorization, Federal Highway Administration, Transportation"
1083,069-8102,"Highway Trust Fund - Treasury Managed, Transportation"
1084,069-8103,"Airport and Airway Trust Fund - Treasury Managed, Transportation"
1085,069-8104,"Operations, Airport and Airway Trust Fund, Federal Aviation Administration, Transportation"
1086,069-8106,"Grants-In-Aid for Airports, Liquidation of Contract Authorization, Airport and Airway Trust Fund, Federal Aviation Administration, Transportation"
1087,069-8107,"Facilities and Equipment, Airport and Airway Trust Fund, Federal Aviation Administration, Transportation"
1088,069-8108,"Research, Engineering and Development, Airport and Airway Trust Fund, Federal Aviation Administration, Transportation"
1089,069-8120,"Corridor Safety Improvement Demonstration Project, Federal Highway Administration, Transportation"
1090,069-8121,"Trust Fund Share of Pipeline Safety, Pipeline and Hazardous Materials Safety Administration, Transportation"
1091,069-8158,"Motor Carrier Safety Grants, Federal Motor Carrier Safety Administration, Transportation"
1092,069-8159,"Motor Carrier Safety Operations and Programs, Federal Motor Carrier Safety Administration, Transportation"
1093,069-8191,"Discretionary Grants, Liquidation of Contract Authorization, Highway Trust Fund, Federal Transit Administration, Transportation"
1094,069-8264,"Contributions for Highway Research Program, Federal Highway Administration, Transportation"
1095,069-8265,"Cooperative Work, Forest Highways, Federal Highway Administration, Transportation"
1096,069-8304,"Payment to Air Carriers, Office of the Secretary, Transportation"
1097,069-8309,"Right of Way Revolving Fund Program Account, Federal Highway Administration, Transportation"
1098,069-8350,"Formula and Bus Grants, Liquidation of Contract Authorization, Federal Transit Administration, Transportation"
1099,069-8362,"National Driver Register, National Highway Traffic Safety Administration, Transportation"
1100,069-8371,"International Highway Transportation Outreach Program, Federal Highway Administration, Transportation"
1101,069-8381,"Pennsylvania Reconstruction Demonstration Project, Federal Highway Administration, Transportation"
1102,069-8382,"Highway Projects, Federal Highway Administration, Transportation"
1103,069-8386,"Mineola Grade Crossing, Federal Highway Administration, Transportation"
1104,069-8402,"Right-of-Way Revolving Fund, Liquidation of Contract Authorization, Trust Fund, Federal Highway Administration, Transportation"
1105,069-8502,"Technical Assistance, United States Dollars Advanced from Foreign Governments, Federal Highway Administration, Transportation"
1106,069-8503,"Gifts and Bequests, Maritime Administration, Transportation"
1107,069-8547,"Special Studies, Services and Projects, Maritime Administration, Transportation"
1108,069-8548,"Gifts and Bequests, Office of the Secretary, Transportation"
1109,069-8632,"Equipment, Supplies, Etc., for Cooperating Countries, Federal Highway Administration, Transportation"
1110,069-8634,"National Surface Transportation Finance Bureau, Highway Trust Fund Account, Transportation"
1111,070-0100,"Operations and Support, Office of the Secretary and Executive Management, Departmental Management, Intelligence, Situational Awareness, and Oversight, Homeland Security"
1112,070-0101,"Counterterrorism Fund, Departmental Management, Intelligence, Situational Awareness, and Oversight, Homeland Security"
1113,070-0102,"Department-Wide Technology Investments, Departmental Management, Intelligence, Situational Awareness, and Oversight, Homeland Security"
1114,070-0110,"Office of the Secretary and Executive Management, Departmental Management and Operations, Homeland Security"
1115,070-0111,"Office of the Under Secretary for Management, Departmental Management and Operations, Homeland Security"
1116,070-0112,"Operations and Support, Management Directorate, Departmental Management, Intelligence, Situational Awareness, and Oversight, Homeland Security"
1117,070-0113,"Office of the Chief Information Officer, Departmental Management, Intelligence, Situational Awareness, and Oversight, Homeland Security"
1118,070-0115,"Operations and Support, Intelligence, Analysis, and Operations Coordination, Departmental Management, Intelligence, Situational Awareness, and Oversight, Homeland Security"
1119,070-0200,"Operations and Support, Office of the Inspector General, Homeland Security"
1120,070-0300,"Operations and Support, U.S. Citizenship and Immigration Services, Homeland Security"
1121,070-0400,"Operations and Support, United States Secret Service, Homeland Security"
1122,070-0401,"Procurement, Construction, and Improvements, United States Secret Service, Homeland Security"
1123,070-0405,"Contribution for Annuity Benefits, United States Secret Service, Homeland Security"
1124,070-0406,"Procurement, Construction, and Improvements, Management Directorate, Departmental Management, Intelligence, Situational Awareness, and Oversight, Homeland Security"
1125,070-0407,"Procurement, Construction, and Improvements, United States Citizenship and Immigration Services, Homeland Security"
1126,070-0408,"Federal Assistance, U.S. Citizenship and Immigration Services, Homeland Security"
1127,070-0410,"Procurement, Construction, and Improvements, Transportation Security Administration, Homeland Security"
1128,070-0411,"Federal Assistance, Countering Weapons of Mass Destruction Office, Homeland Security"
1129,070-0412,"Procurement, Construction, and Improvements, Cybersecurity and Infrastructure Security Agency, Homeland Security"
1130,070-0413,"Federal Assistance, Federal Emergency Management Agency, Homeland Security"
1131,070-0414,"Procurement, Construction, and Improvements, Federal Emergency Management Agency, Homeland Security"
1132,070-0415,"Procurement, Construction, and Improvements, Science and Technology Directorate, Homeland Security"
1133,070-0416,"Federal Assistance, Office of the Secretary and Executive Management, Departmental Management, Intelligence, Situational Awareness, and Oversight, Homeland Security"
1134,070-0500,"Flood Hazard Mapping and Risk Analysis Program, Federal Emergency Management Agency, Homeland Security"
1135,070-0503,"Customs and Border Protection, USCS, Homeland Security"
1136,070-0504,"Immigration and Customs Enforcement, Border and Transportation Security, Homeland Security"
1137,070-0505,"Refunds and Drawbacks, United States Customs Service (Indefinite), Treasury"
1138,070-0508,"Expenses, Transportation Security Administration, Border and Transportation Security, Homeland Security"
1139,070-0509,"Operations and Support, Federal Law Enforcement Training Centers, Homeland Security"
1140,070-0510,"Procurement, Construction, and Improvements, Federal Law Enforcement Training Centers, Homeland Security"
1141,070-0521,"Office of Biometric Identity Management, National Protection and Programs Directorate, Homeland Security"
1142,070-0530,"Operations and Support, U.S. Customs and Border Protection, Homeland Security"
1143,070-0531,"Automation Modernization, U.S. Customs and Border Protection, Homeland Security"
1144,070-0532,"Procurement, Construction, and Improvements, U.S. Customs and Border Protection, Homeland Security"
1145,070-0533,"Border Security Fencing, Infrastructure, and Technology, U.S. Customs and Border Protection, Homeland Security"
1146,070-0540,"Operations and Support, U.S. Immigration and Customs Enforcement, Homeland Security"
1147,070-0541,"Federal Air Marshals, Transportation Security Administration,  Homeland Security"
1148,070-0542,"Federal Protective Service, Management Directorate, Departmental Management, Intelligence, Situational Awareness, and Oversight, Homeland Security"
1149,070-0543,"Automation Modernization, U.S. Immigration and Customs Enforcement, Homeland Security"
1150,070-0544,"Air and Marine Operations, U.S. Customs and Border Protection, Homeland Security"
1151,070-0545,"Procurement, Construction, and Improvements, U.S. Immigration and Customs Enforcement, Homeland Security"
1152,070-0550,"Operations and Support, Transportation Security Administration, Homeland Security"
