account_id,federal_account_symbol,federal_account_name
1,005-0107,"Salaries and Expenses, Government Accountability Office"
2,010-0930,"Court Security, Court of Appeals, District Courts, and Other Judicial Services, The Judiciary"
3,011-0040,"United States Emergency Refugee and Migration Assistance Fund, Funds Appropriated to the President, Executive Office of the President"
4,011-0100,"Peace Corps, Funds Appropriated to the President"
5,011-0101,"Foreign Currency Fluctuations, Peace Corps"
6,011-1001,"Trade and Development Agency, Funds Appropriated to the President"
7,011-1008,"Contribution to the North American Development Bank, Funds Appropriated to the President"
8,011-1022,"International Narcotics Control and Law Enforcement, International Security Assistance, State"
9,011-1032,"Peacekeeping Operations, Funds Appropriated to the President"
10,011-1041,"Global Security Contingency Fund, State"
11,011-1071,"Nonproliferation and Disarmament Fund, Funds Appropriated to the President"
12,011-1075,"Non-Proliferation, Anti-Terrorism, Demining and Related Programs, International Security Assistance, State"
13,011-1081,"International Military Education and Training, Funds Appropriated to the President"
14,011-1082,"Foreign Military Financing Program, Funds, Appropriated to the President"
15,011-1085,"Foreign Military Financing, Direct Loan Program Account, Funds Appropriated to the President"
16,011-4116,"Special Defense Acquisition Fund, Funds Appropriated to the President"
17,011-4121,"Foreign Military Loan Liquidating Account, Funds Appropriated to the President"
18,011-5395,"Host Country Resident Contractors Separation Liability Fund, Peace Corps"
19,011-8242,"Advances, Foreign Military Sales, Funds Appropriated to the President"
20,011-8245,"Gifts and Contributions, Peace Corps"
21,011-8246,"Advances from Foreign Governments, Peace Corps"
22,011-8345,"Foreign Service National Separation Liability Trust Fund, Peace Corps"
23,012-0013,"Expenses, Office of the Chief Information Officer, Agriculture"
24,012-0014,"Expenses, Office of the Chief Financial Officer, Agriculture"
25,012-0015,"Healthy Foods Financing Initiative, Rural Business-Cooperative Service, Agriculture"
26,012-0017,"Emergency Watershed Protection Program, Natural Resources Conservation Programs, Agriculture"
27,012-0113,"Expenses, Common Computing Environment, Agriculture"
28,012-0115,"Processing, Research and Marketing, Office of the Secretary, Agriculture"
29,012-0117,"Agriculture Buildings and Facilities, Agriculture"
30,012-0123,"Office of the Chief Economist, Executive Operations, Agriculture"
31,012-0124,"Office of the Under Secretary for Research, Education and Economics, Agriculture"
32,012-0125,"Office of the Under Secretary for Marketing and Regulatory Programs, Cooperative State Research, Education, and Extension Service, Agriculture"
33,012-0126,"Office of the Under Secretary for Farm and Foreign Agricultural Services, Agriculture"
34,012-0127,"Office of the Under Secretary for Rural Development, Agriculture"
35,012-0128,"Office of the Assistant Secretary for Natural Resources and Environment, Agriculture"
36,012-0129,"Office of the Under Secretary for Food, Nutrition and Consumer Services, Agriculture"
37,012-0130,"Office of the Assistant Secretary for Civil Rights, Agriculture"
38,012-0133,"Nonrecurring Expenses Fund, Office of the Chief Financial Officer, Agriculture"
39,012-0136,"Office of Ethics, Agriculture"
40,012-0137,"Rental Assistance Program, Rural Housing Service, Agriculture"
41,012-0170,"State Mediation Grants, Farm Service Agency, Agriculture"
42,012-0171,"Emergency Forest Restoration Program, Farm Service Agency, Agriculture"
43,012-0176,"Office of the Under Secretary for Trade and Foreign Agricultural Affairs, Office of the Secretary, Agriculture"
44,012-0177,"Office of Codex Alimentarius, Office of the Secretary, Agriculture"
45,012-0180,"Farm Production and Conservation Business Center, Farm Production and Conservation Programs, Agriculture"
46,012-0403,"Salaries and Expenses, Rural Development, Agriculture"
47,012-0405,"Rural Development Disaster Assistance Fund, Rural Development, Agriculture"
48,012-0408,"Food Supply Chain and Agriculture Pandemic Response Program Account, Office of the Secretary, Agriculture"
49,012-0470,"Office of Safety, Security, and Protection, Executive Operations, Agriculture"
50,012-0500,"Hazardous Materials Management, Agriculture"
51,012-0502,"Extension Activities, National Institute of Food and Agriculture, Agriculture"
52,012-0503,"Office of Budget and Program Analysis, Executive Operations, Agriculture"
53,012-0600,"Salaries and Expenses, Farm Service Agency, Agriculture"
54,012-0601,"Outreach for Socially Disadvantaged Farmers, Office of the Secretary, Agriculture"
55,012-0706,"Office of Hearings and Appeals Division, Executive Operations, Agriculture"
56,012-0900,"Office of the Inspector General, Agriculture"
57,012-1000,"Conservation Operations, Natural Resources Conservation Service, Agriculture"
58,012-1002,"Watershed Rehabilitation Program, Natural Resources Conservation Service, Agriculture"
59,012-1003,"Biomass Research and Development, National Institute of Food and Agriculture, Agriculture"
60,012-1004,"Farm Security and Rural Investment Programs, Natural Resources Conservation Service, Agriculture"
61,012-1005,"Urban Agriculture and Innovative Production, Natural Resource and Conservation Service, Agriculture"
62,012-1010,"Resource Conservation and Development, Natural Resources Conservation Services, Agriculture"
63,012-1072,"Watershed and Flood Prevention Operations, Natural Resources Conservation Service, Agriculture"
64,012-1090,"Healthy Forests Reserve Program, Natural Resources Conservation Service, Agriculture"
65,012-1103,"Capital Improvement and Maintenance, Forest Service, Agriculture"
66,012-1104,"Forest and Rangeland Research, Forest Service, Agriculture"
67,012-1105,"State and Private Forestry, Forest Service, Agriculture"
68,012-1106,"National Forest System, Forest Service, Agriculture"
69,012-1115,"Wildland Fire Management, Forest Service, Agriculture"
70,012-1119,"Management of National Forest Lands for Subsistence Uses, Forest Service, Agriculture"
71,012-1121,"Wildfire Suppression Operations Reserve Fund, Forest Service, Agriculture"
72,012-1122,"Forest Service Operations, Forest Service, Agriculture"
73,012-1124,"Assistance for Farmers and Ranchers Account, Farm Service Agency, Agriculture"
74,012-1140,"Agricultural Credit Insurance Fund Program Account,  Farm Service Agency, Agriculture"
75,012-1230,"Rural Electrification and Telecommunications Loans Program Account, Rural Utilities Service, Agriculture"
76,012-1232,"Distance Learning, Telemedicine and Broadband Program, Rural Utilities Service, Agriculture"
77,012-1336,"Commodity Credit Corporation Export Loans Program Account, Foreign Agricultural Service, Agriculture"
78,012-1400,"Salaries and Expenses, Agricultural Research Service, Agriculture"
79,012-1401,"Buildings and Facilities, Agricultural Research Service, Agriculture"
80,012-1500,"Research and Education Activities, National Institute of Food and Agriculture, Agriculture"
81,012-1502,"Integrated Activities, National Institute of Food and Agriculture, Agriculture"
82,012-1600,"Salaries and Expenses, Animal and Plant Health Inspection Service, Agriculture"
83,012-1601,"Buildings and Facilities, Animal and Plant Health Inspection Service, Agriculture"
84,012-1701,"Economic Research Service, Agriculture"
85,012-1801,"National Agricultural Statistics Service, Agriculture"
86,012-1900,"Rural Cooperative Development Grants, Rural Business-Cooperative Service, Agriculture"
87,012-1902,"Rural Business Program Account, Rural Business-Cooperative Service, Agriculture"
88,012-1907,"Rural Business Investment Program Account, Rural Business - Cooperative Service, Agriculture"
89,012-1908,"Rural Energy for America Program, Rural Business-Cooperative Service, Agriculture"
90,012-1951,"Rural Community Facilities Program Account, Rural Housing Service, Agriculture"
91,012-1953,"Expenses, Rural Housing Assistance Grants, Rural Housing Service, Agriculture"
92,012-1955,"Rural Microentrepreneur Assistance Program, Rural Business-Cooperative Service, Agriculture"
93,012-1980,"Rural Water and Waste Disposal Program Account, Rural Utilities Service, Agriculture"
94,012-2002,"Multi-Family Housing Revitalization Program Account, Rural Housing Service, Agriculture"
95,012-2006,"Mutual and Self-Help Housing Grants, Rural Housing Service, Agriculture"
96,012-2042,"High Energy Cost Grants, Rural Utilities Service, Agriculture"
97,012-2069,"Intermediary Relending Program Fund Account, Rural Business-Cooperative Service, Agriculture"
98,012-2073,"Energy Assistance Payments, Rural Business - Cooperative Service, Agriculture"
99,012-2081,"Rural Housing Insurance Fund Program Account, Rural Housing Service, Agriculture"
100,012-2274,"Public Law 480, Liquidating Account, Foreign Agriculture Service, Agriculture"
101,012-2277,"Public Law 480 Title I Direct Credit and Food for Progress Program Account, Foreign Agricultural Service, Agriculture"
102,012-2278,"Food for Peace Title II Grants, Foreign Agricultural Service, Agriculture"
103,012-2300,"Office of the General Counsel, Agriculture"
104,012-2500,"Marketing Services, Agricultural Marketing Service, Agriculture"
105,012-2501,"Payments to States and Possessions, Agricultural Marketing Service, Agriculture"
106,012-2701,"USDA Disaster Assistance, Farm Service Agency, Agriculture"
107,012-2707,"Administrative and Operating Expenses, Office of Risk Management, Agriculture"
108,012-2900,"Salaries and Expenses, Foreign Agricultural Service, Agriculture"
109,012-2903,"McGovern-Dole International Food for Education and Child Nutrition Program, Foreign Agricultural Service, Agriculture"
110,012-3105,"Rural Economic Development Grants, Rural Business-Cooperative Service, Agriculture"
111,012-3106,"Biorefinery Assistance Program Account, Rural Business - Cooperative Service, Agriculture"
112,012-3108,"Rural Economic Development Loans Program Account, Rural Business-Cooperative Service, Agriculture"
113,012-3301,"Farm Storage Facility Loans Program Accounts, Farm Service Agency, Agriculture"
114,012-3304,"Grassroots Source Water Protection Program, Farm Service Agency, Agriculture"
115,012-3314,"Dairy Indemnity Program, Farm Service Agency, Agriculture"
116,012-3316,"Emergency Conservation Program, Farm Service Agency, Agriculture"
117,012-3319,"Conservation Reserve Program, Farm Service Agency, Agriculture"
118,012-3320,"Water Bank Program, Natural Resources Conservation Service, Agriculture"
119,012-3322,"Wildlife Habitat Incentives Program, Natural Resources Conservation Service, Agriculture"
120,012-3505,"Supplemental Nutrition Assistance Program, Food and Nutrition Service, Agriculture"
121,012-3507,"Commodity Assistance Program, Food and Nutrition Service, Agriculture"
122,012-3508,"Nutrition Programs Administration, Food and Nutrition Service, Agriculture"
123,012-3510,"Special Supplemental Nutrition Program for Women, Infants and Children (WIC), Food and Nutrition Service"
124,012-3539,"Child Nutrition Programs, Food and Nutrition Service"
125,012-3674,"Reimbursement for Net Realized Losses, Commodity Credit Corporation"
126,012-3700,"Food Safety and Inspection Service, Agriculture"
127,012-3701,"Office of the Under Secretary for Food Safety, Agriculture"
128,012-3800,"Office of Civil Rights, Agriculture"
129,012-4050,"Inspection and Weighing Services, Grain Inspection, Packers and Stockyards Administration, Agriculture"
130,012-4085,"Federal Crop Insurance Corporation Fund, Risk Management Agency, Agriculture"
131,012-4140,"Agricultural Credit Insurance Fund, Liquidating Account, Consolidated Farm Service Agency, Agriculture"
132,012-4141,"Rural Housing Insurance Fund, Liquidating Account, Rural Housing Service, Agriculture"
133,012-4144,"Alternative Agricultural Research and Commercialization Revolving Fund, Rural Business-Cooperative Service, Agriculture"
134,012-4155,"Rural Development Insurance Fund, Liquidating Account, Rural Utilities Service, Agriculture"
135,012-4230,"Rural Electrification and Telephone Revolving Fund, Liquidating Account, Rural Utilities Service, Agriculture"
136,012-4233,"Rural Development Loan Fund, Liquidating Account, Rural Business-Cooperative Service, Agriculture"
137,012-4336,"Commodity Credit Corporation Fund, Agriculture"
138,012-4368,"Damage Assessment and Restoration Revolving Fund, Agriculture"
139,012-4605,"Working Capital Fund, Forest Service,  Agriculture"
140,012-4609,"Working Capital Fund, Agriculture"
141,012-5004,"Land Acquisition, Forest Service, Agriculture"
142,012-5070,"Perishable Agricultural Commodities Act Fund, Agricultural Marketing Service, Agriculture"
143,012-5161,"Agricultural Quarantine Inspection User Fee Account, Animal and Plant Health Inspection Service, Agriculture"
144,012-5201,"Payments to States, National Forests Fund,  Forest Service, Agriculture"
145,012-5202,"Timber Roads, Purchaser Elections, Forest Service, Agriculture"
146,012-5203,"Roads and Trails for States, National Forests Fund, Forest Service, Agriculture"
147,012-5204,"Timber Salvage Sales, Forest Service,  Agriculture"
148,012-5205,"Native American Institutions Endowment Fund, Agriculture"
149,012-5206,"Expenses, Brush Disposal, Forest Service,  Agriculture"
150,012-5207,"Range Betterment Fund, Forest Service, Agriculture"
151,012-5208,"Acquisition of Lands for National Forests, Special Acts, Forest Service, Agriculture"
152,012-5209,"Funds for Strengthening Markets, Income, and Supply (Section 32), Agriculture"
153,012-5213,"Payment to Minnesota (Cook, Lake, and Saint Louis Counties) from the National Forests Fund, Forest Service, Agriculture"
154,012-5214,"Licensee Programs, Forest Service, Agriculture"
155,012-5215,"Restoration of Forest Lands and Improvements, Forest Service, Agriculture"
156,012-5216,"Acquisition of Lands to Complete Land Exchanges, Forest Service, Agriculture"
157,012-5219,"Operation and Maintenance of Quarters, Forest Service, Agriculture"
158,012-5223,"Quinault Special Management Area, Forest Service, Agriculture"
159,012-5264,"Timber Sales Pipeline Restoration Fund, Forest Service, Agriculture"
160,012-5268,"Recreation Fee Demonstration Program, Forest Service,  Agriculture"
161,012-5277,"MNP Rental Fee Account, Forest Service, Agriculture"
162,012-5279,"Concessions Fees and Volunteer Services, Agricultural Research Service, Agriculture"
163,012-5360,"Land Between the Lakes Management Fund, Forest Service,  Agriculture"
164,012-5361,"Administration of Rights-of-Way and Other Land Uses Fund, Forest Service,  Agriculture"
165,012-5367,"State and Private Forestry, Forest Service,  Agriculture"
166,012-5410,"Inspector General Assets Forfeiture, Justice"
167,012-5411,"Inspector General Assets Forfeiture, Treasury"
168,012-5462,"Hardwood Technology Transfer and Applied Research Fund, Forest Service,  Agriculture"
169,012-5531,"Agricultural Disaster Relief Trust Fund, Farm Service Agency, Agriculture"
170,012-5540,"Stewardship Contracting Product Sales, Forest Service, Agriculture"
171,012-5635,"Pima Agriculture Cotton Trust Fund, Farm Service Agency, Agriculture"
172,012-5636,"Agriculture Wool Apparel Manufacturers Trust Fund, Farm Service Agency, Agriculture"
173,012-5644,"Recreation Residence Program, Forest Service, Agriculture"
174,012-5716,"National Parks and Public Land Legacy Restoration Fund, Forest Service, Agriculture"
175,012-5896,"Payments to Counties, National Grasslands, Forest Service,  Agriculture"
176,012-8015,"Expenses and Refunds, Inspection and Grading of Farm Products, Agricultural Marketing Service, Agriculture"
177,012-8028,"Cooperative Work, Forest Service,  Agriculture"
178,012-8034,"Donations for Forest and Rangeland Research, Forest Service, Agriculture"
179,012-8039,"Land Between the Lakes Trust Fund, Forest Service,  Agriculture"
180,012-8046,"Reforestation Trust Fund, Forest Service, Agriculture"
181,012-8100,"Wool Research, Development and Promotion Trust Fund, Agricultural Marketing Service, Agriculture"
182,012-8137,"Expenses and Refunds, Inspection of Farm Products, Food Safety and Inspection Service, Agriculture"
183,012-8161,"Tobacco Trust Fund, Commodity Credit Corporation, Agriculture"
184,012-8203,"Gifts and Bequests, Agriculture"
185,012-8210,"Miscellaneous Contributed Funds, Natural Resources Conservation Service, Agriculture"
186,012-8214,"Miscellaneous Contributed Funds, Agricultural Research Service, Agriculture"
187,012-8218,"Miscellaneous Contributed Funds, National Agricultural Statistics Service, Agriculture"
188,012-8226,"Miscellaneous Contributed Funds, Animal and Plant Health Inspection Service, Agriculture"
189,012-8232,"Miscellaneous Contributed Funds, Foreign Agricultural Service, Agriculture"
190,012-8505,"Foreign Service National Separation Liability Trust Fund, Foreign Agricultural Service, Agriculture"
191,012-8558,"Foreign Service National Separation Liability Trust Fund, Animal and Plant Health Inspection Service, Agriculture"
192,012-8559,"Emergency Citrus Disease Research and Development Trust Fund, National Institute of Food and Agriculture, Agriculture"
193,013-0110,"Office of Inspector General - Recovery Act, Departmental Management, Commerce"
194,013-0120,"Salaries and Expenses, Departmental Management, Commerce"
195,013-0123,"Renovation and Modernization, Departmental Management, Commerce"
196,013-0125,"Salaries and Expenses, Economic Development Administration, Commerce"
197,013-0126,"Office of the Inspector General, Departmental Management, Commerce"
198,013-0133,"Nonrecurring Expenses Fund, Departmental Management, Commerce"
199,013-0201,"Minority Business Development, Minority Business Development Agency, Commerce"
200,013-0300,"Operations and Administration, Bureau of Industry and Security, Commerce"
201,013-0401,"Current Surveys and Programs, Bureau of the Census, Commerce"
202,013-0450,"Periodic Censuses and Programs, Bureau of the Census, Commerce"
203,013-0500,"Scientific and Technical Research and Services, National Institute of Standards and Technology, Commerce"
204,013-0513,"Wireless Innovation(WIN) Fund, National Institute of Standards and Technology, Commerce"
205,013-0515,"Construction of Research Facilities, National Institute of Standards and Technology, Commerce"
206,013-0516,"State and Local Implementation Fund, National Telecommunications and Information Administration, Commerce"
207,013-0520,"Creating Helpful Incentives to Produce Semiconductors (CHIPS) for America Fund, NIST, Commerce"
208,013-0521,"Creating Helpful Incentives to Produce Semiconductors (CHIPS) Loan Program Account, National Institute of Standards and Technology, Commerce"
209,013-0525,"Industrial Technology Services, National Institute of Standards and Technology, Commerce"
210,013-0550,"Salaries and Expenses, National Telecommunications and Information Administration, Commerce"
211,013-0551,"Public Telecommunications Facilities, Planning and Construction, National Telecommunications and Information, Commerce"
212,013-0560,"Broadband Connectivity Fund, National Telecommunications and Information Administration, Commerce"
213,013-0561,"Connecting Minority Communities Fund, National Telecommunications and Information Administration, Commerce"
214,013-0562,"Broadband Equity, Access, and Deployment Program, National Telecommunications and Information Administration, Commerce"
215,013-0563,"Digital Equity, National Telecommunications and Information Administration, Commerce"
216,013-0564,"Middle Mile Deployment, National Telecommunications and Information Administration, Commerce"
217,013-0565,"Public Wireless Supply Chain Innovation Fund, National Telecommunications and Information Administration, Commerce"
218,013-1006,"Salaries and Expenses, United States Patent and Trademark Office, Commerce"
219,013-1250,"Operations and Administration, International Trade Administration, Commerce"
220,013-1450,"Operations, Research and Facilities, National Oceanic and Atmospheric Administration, Commerce"
221,013-1451,"Pacific Coastal Salmon Recovery, National Oceanic and Atmospheric, Commerce"
222,013-1455,"Gulf Coast Ecosystem Restoration Science, Observation, Monitoring and Technology, National Oceanic and Atmospheric Administration, Commerce"
223,013-1456,"Fisheries Finance Program Account, National Oceanic and Atmospheric Administration, Commerce"
224,013-1460,"Procurement, Acquisition and Construction, National Oceanic and Atmospheric Administration, Commerce"
225,013-1465,"NOAA Accrual Contribution to the Uniformed Services Retiree Health, Commerce"
226,013-1500,"Salaries and Expenses, Economic and Statistical Analysis, Commerce"
227,013-2047,"IT System Modernization and Working Capital Fund, NOAA, Commerce"
228,013-2050,"Economic Development Assistance Programs, Economic Development Administration, Commerce"
229,013-2055,"Fisheries Disaster Assistance, National Oceanic and Atmospheric Administration, Commerce"
230,013-2056,"Facilities Management and Construction, National Telecommunications and Information Administration, Commerce"
231,013-4295,"NTIS Revolving Fund, National Technical Information Service, Commerce"
232,013-4313,"Coastal Zone Management Fund, National Oceanic Atmospheric Administration, Commerce"
233,013-4316,"Damage Assessment and Restoration Revolving Fund, National Oceanic and Atmospheric Administration, Commerce"
234,013-4323,"Economics and Statistics Administration Revolving Fund, Economic and Statistical Analysis, Commerce"
235,013-4358,"Network Construction Fund, Telecommunications and Information Administration, Commerce"
236,013-4417,"Federal Ship Financing Fund, Fishing Vessels, Liquidating Account, National Oceanic and Atmospheric Administration, Commerce"
237,013-4421,"First Responder Network Authority, National Telecommunications and Information Administration, Commerce"
238,013-4511,"Working Capital Fund, Departmental Management, Commerce"
239,013-4512,"Census Working Capital Fund, Bureau of the Census, Commerce"
240,013-4650,"Working Capital Fund, National Institute of Standards and Technology, Commerce"
241,013-5120,"Fishermen's Contingency Fund, National Oceanic and Atmospheric Administration, Commerce"
242,013-5122,"Foreign Fishing Observer Fund, National Oceanic and Atmospheric Administration, Commerce"
243,013-5139,"Promote and Develop Fishery Products and Research Pertaining to American Fisheries, National Oceanic and Atmospheric Administration, Commerce"
244,013-5283,"Marine Mammal Unusual Mortality Event Fund, National Oceanic and Atmospheric Administration, Commerce"
245,013-5284,"Limited Access System Administration Fund, National Oceanic and Atmospheric Administration, Commerce"
246,013-5362,"Environmental Improvement and Restoration Fund, National Oceanic and Atmospheric Administration, Commerce"
247,013-5396,"Digital Television Transition and Public Safety Fund, National Telecommunications and Information Administration, Commerce"
248,013-5439,"Western Pacific Sustainable Fisheries Fund, National Oceanic and Atmospheric Administration, Commerce"
249,013-5521,"Grants to Manufacturers of Worsted Wool Fabrics, International Trade Commission, Commerce"
250,013-5583,"Fisheries Enforcement Asset Forfeiture Fund, National Oceanic and Atmospheric Administration, Commerce"
251,013-5584,"Sanctuaries Enforcement Asset Forfeiture Fund, National Oceanic and Atmospheric Administration, Commerce"
252,013-5598,"North Pacific Fishery Observer Fund, National Oceanic and Atmospheric Administration, Commerce"
253,013-8233,"Public Safety Trust Fund, National Telecommunications and Information Administration, Commerce"
254,013-8501,"Gifts and Bequests, Departmental Management, Commerce"
255,014-0102,"Departmental Operations, Office of the Secretary, Interior"
256,014-0104,"Salaries and Expenses, Office of the Inspector General, Interior"
257,014-0107,"Salaries and Expenses, Office of the Solicitor, Interior"
258,014-0118,"Salaries and Expenses, National Indian Gaming Commission, Interior"
259,014-0120,"Federal Trust Programs, Bureau of Trust Funds Administration, Interior"
260,014-0130,"Wildfire Suppression Operations Reserve Fund, Department-Wide Programs, Interior"
261,014-0200,"Payments for Tribal Leases, Bureau of Indian Affairs, Interior"
262,014-0412,"Assistance to Territories, Insular Affairs, Interior"
263,014-0415,"Compact of Free Association, Insular Affairs, Interior"
264,014-0667,"Loan Program, Liquidating Account, Bureau of Reclamation, Interior"
265,014-0680,"Water and Related Resources, Bureau of Reclamation, Interior"
266,014-0681,"Water and Related Resources - Recovery Act, Bureau of Reclamation, Interior"
267,014-0685,"Bureau of Reclamation Loans Program Account, Bureau of Reclamation, Interior"
268,014-0687,"California Bay-Delta Restoration, Bureau of Reclamation, Interior"
269,014-0787,"Central Utah Project Completion Account, Central Utah Project, Interior"
270,014-0804,"Surveys, Investigations and Research, U.S. Geological Survey"
271,014-0959,"Mines and Minerals, Bureau of Mines, Interior"
272,014-1034,"Contribution for Annuity Benefits, National Park Service, Interior"
273,014-1036,"Operation of the National Park System, National Park Service, Interior"
274,014-1039,"Construction, National Park Service, Interior"
275,014-1042,"National Recreation and Preservation, National Park Service, Interior"
276,014-1046,"Historic Preservation Fund, National Park Service, Interior"
277,014-1109,"Management of Lands and Resources, Bureau of Land Management, Interior"
